[
  {
    "id": "a1b2c3d4e5f6789012345678abcdef01",
    "timestamp": "2026-03-02T10:00:00Z",
    "type": "capture",
    "content": "明天下午3点开会",
    "hash": "e3b0c44298fc1c149afbf4c8996fb92427ae41e4649b934ca495991b7852b855",
    "prev_hash": null,
    "device_id": "dev_abc123def456",
    "payload_encrypted": false
  },
  {
    "id": "b2c3d4e5f6789012345678abcdef012",
    "timestamp": "2026-03-02T10:05:00Z",
    "type": "capture",
    "content": "买牛奶、鸡蛋、面包",
    "hash": "a7ffc6f8bf1ed76651c14756a061d662f580ff4de43b49fa82d80a4b80f8434",
    "prev_hash": "e3b0c44298fc1c149afbf4c8996fb92427ae41e4649b934ca495991b7852b855",
    "device_id": "dev_abc123def456",
    "payload_encrypted": false
  },
  {
    "id": "c3d4e5f6789012345678abcdef0123",
    "timestamp": "2026-03-02T10:10:00Z",
    "type": "capture",
    "content": "记得给妈妈打电话",
    "hash": "b5bb9d8014a0f9b1d61e4e5f4d7a1f3e3d8e4c8f8d9a0b1c2d3e4f5a6b7c8d",
    "prev_hash": "a7ffc6f8bf1ed76651c14756a061d662f580ff4de43b49fa82d80a4b80f8434",
    "device_id": "dev_abc123def456",
    "payload_encrypted": false
  },
  {
    "id": "d4e5f6789012345678abcdef01234",
    "timestamp": "2026-03-02T10:15:00Z",
    "type": "capture",
    "content": "周报要交，截止日期是周五",
    "hash": "c9f9f8e7a6b5c4d3e2f1a0b9c8d7e6f5a4b3c2d1e0f9a8b7c6d5e4f3a2b1",
    "prev_hash": "b5bb9d8014a0f9b1d61e4e5f4d7a1f3e3d8e4c8f8d9a0b1c2d3e4f5a6b7c8d",
    "device_id": "dev_abc123def456",
    "payload_encrypted": false
  },
  {
    "id": "e5f6789012345678abcdef012345",
    "timestamp": "2026-03-02T10:20:00Z",
    "type": "capture",
    "content": "看一部电影《星际穿越》",
    "hash": "d1e2f3a4b5c6d7e8f9a0b1c2d3e4f5a6b7c8d9e0f1a2b3c4d5e6f7a8b9c0d1e2f",
    "prev_hash": "c9f9f8e7a6b5c4d3e2f1a0b9c8d7e6f5a4b3c2d1e0f9a8b7c6d5e4f3a2b1",
    "device_id": "dev_abc123def456",
    "payload_encrypted": false
  }
]
