{
  "id": "e5f6789012345678abcdef012345",
  "timestamp": "2026-03-02T10:20:00Z",
  "type": "capture",
  "content": "看一部电影《星际穿越》",
  "hash": "d1e2f3a4b5c6d7e8f9a0b1c2d3e4f5a6b7c8d9e0f1a2b3c4d5e6f7a8b9c0d1e2f",
  "prev_hash": "c9f9f8e7a6b5c4d3e2f1a0b9c8d7e6f5a4b3c2d1e0f9a8b7c6d5e4f3a2b1",
  "device_id": "dev_abc123def456",
  "payload_encrypted": false
}
